{
  "id": "rush-dashboard-20260801T101010Z",
  "parent_id": null,
  "mode": "greenfield",
  "goal": "Ship a rough analytics dashboard before the demo.",
  "constraints": [
    "Server-side generation",
    "Admins only",
    "Max 50k rows per export"
  ],
  "success_criteria": [
    {
      "id": "AC1",
      "statement": "Admin clicks Export and downloads a CSV of the filtered orders.",
      "verify": "Manual: filter orders, click Export, open the file, row count matches the table."
    },
    {
      "id": "AC2",
      "statement": "Non-admins never see the Export button.",
      "verify": "Automated: request as a non-admin returns 403 and the button is absent."
    }
  ],
  "non_goals": [
    "XLSX or PDF export",
    "Scheduled/emailed exports"
  ],
  "assumptions": [
    "The orders table already supports server-side filtering."
  ],
  "open_questions": [
    "Which metrics matter most is still unsettled."
  ],
  "ambiguity": {
    "score": 0.54,
    "threshold": 0.2,
    "forced": true,
    "dimensions": {
      "goal": {
        "weight": 0.4,
        "clarity": 0.7
      },
      "constraint": {
        "weight": 0.3,
        "clarity": 0.3
      },
      "success": {
        "weight": 0.3,
        "clarity": 0.3
      }
    }
  },
  "created_at": "2026-08-01T10:10:10Z",
  "content_hash": "sha256:cf4ac300f5020adbb89295d7d47b1256bc311499e7cf13b71024d2c94e3d535b",
  "frozen": true
}
